{
  "schema_version": "net.lifecycle.request.v1",
  "lifecycle_request_id": "lifecycle_request_demo_stop",
  "subject_id": "endpoint_demo_localhost_http",
  "subject_kind": "endpoint",
  "requested_action": "stop",
  "requested_by_node_id": "node_local_process_demo",
  "reason": "Synthetic lifecycle stop request fixture.",
  "metadata": {
    "synthetic": true,
    "declared_only": true,
    "no_process_control": true,
    "note": "Intent only; no service is stopped."
  },
  "requested_at_unix_ms": 0
}
