{
  "schema_version": "net.lifecycle.request.v1",
  "lifecycle_request_id": "lifecycle_request_demo_status",
  "subject_id": "capability_demo_metrics_stream",
  "subject_kind": "capability",
  "requested_action": "status",
  "requested_by_node_id": "node_local_process_demo",
  "reason": "Synthetic lifecycle status request fixture.",
  "metadata": {
    "synthetic": true,
    "declared_only": true,
    "no_process_control": true,
    "note": "Intent only; no live status check is performed."
  },
  "requested_at_unix_ms": 0
}
