{
  "schema_version": "net.lifecycle.request.v1",
  "lifecycle_request_id": "lifecycle_request_demo_start",
  "subject_id": "node_localhost_service_demo",
  "subject_kind": "node",
  "requested_action": "start",
  "requested_by_node_id": "node_local_process_demo",
  "reason": "Synthetic lifecycle start request fixture.",
  "metadata": {
    "synthetic": true,
    "declared_only": true,
    "no_process_control": true,
    "note": "Intent only; no service is started."
  },
  "requested_at_unix_ms": 0
}
